exports/raw_data_validation_summary.csv

dataset_folder,file_name,size_mb,encoding,row_count,header_count,status,error,headers
canadabuys_award_notices,all_canadabuys_award_notices_2022_08_08_onwards.csv,88.96,utf-8-sig,25885,80,validated,,title-titre-eng | title-titre-fra | referenceNumber-numeroReference | amendmentNumber-numeroModification | solicitationNumber-numeroSollicitation | contractNumber-numeroContrat | publicationDate-datePublication | contractAwardDate-dateAttributionContrat | amendmentDate-dateModification | contractStartDate-contratDateDebut | contractEndDate-dateFinContrat | contractAmount-montantContrat | totalContractValue-valeurTotaleContrat | contractCurrency-contratMonnaie | awardStatus-attributionStatut-eng | awardStatus-attributionStatut-fra | instrumentType-typeInstrument-eng | instrumentType-typeInstrument-fra | amendmentType-typeModification-eng | amendmentType-typeModification-fra | gsin-nibs | gsinDescription-nibsDescription-eng | gsinDescription-nibsDescription-fra | unspsc | unspscDescription-eng | unspscDescription-fra | procurementCategory-categorieApprovisionnement | noticeType-avisType-eng | noticeType-avisType-fra | procurementMethod-methodeApprovisionnement-eng | procurementMethod-methodeApprovisionnement-fra | selectionCriteria-criteresSelection-eng | selectionCriteria-criteresSelection-fra | limitedTenderingReason-raisonAppelOffresLimite-eng | limitedTenderingReason-raisonAppelOffresLimite-fra | tradeAgreements-accordsCommerciaux-eng | tradeAgreements-accordsCommerciaux-fra | regionsOfDelivery-regionsLivraison-eng | regionsOfDelivery-regionsLivraison-fra | supplierLegalName-nomLegalFournisseur-eng | supplierAddressLine-ligneAdresseFournisseur-eng | supplierAddressCity-fournisseurAdresseVille-eng | supplierAddressProvince-fournisseurAdresseProvince-eng | supplierAddressPostalCode-fournisseurAdresseCodePostal | supplierAddressCountry-fournisseurAdressePays-eng | supplierLegalName-nomLegalFournisseur-fra | supplierAddressLine-ligneAdresseFournisseur-fra | supplierAddressCity-fournisseurAdresseVille-fra | supplierAddressProvince-fournisseurAdresseProvince-fra | supplierAddressCountry-fournisseurAdressePays-fra | contractingEntityName-nomEntitContractante-eng | contractingEntityAddressLine-ligneAdresseEntiteContractante-eng | contractingEntityAddressCity-entiteContractanteAdresseVille-eng | contractingEntityAddressProvince-entiteContractanteAdresseProvince-eng | contractingEntityAddressPostalCode-entiteContractanteAdresseCodePostal | contractingEntityAddressCountry-entiteContractanteAdressePays-eng | contractingEntityName-nomEntitContractante-fra | contractingEntityAddressLine-ligneAdresseEntiteContractante-fra | contractingEntityAddressCity-entiteContractanteAdresseVille-fra | contractingEntityAddressProvince-entiteContractanteAdresseProvince-fra | contractingEntityAddressCountry-entiteContractanteAdressePays-fra | endUserEntitiesName-nomEntitesUtilisateurFinal-eng | endUserEntitiesAddress-adresseEntitesUtilisateurFinal-eng | endUserEntitiesName-nomEntitesUtilisateurFinal-fra | endUserEntitiesAddress-adresseEntitesUtilisateurFinal-fra | contactInfoName-informationsContactNom | contactInfoEmail-informationsContactCourriel | contactInfoPhone-contactInfoTelephone | contactInfoFax | contactInfoAddressLine-contactInfoAdresseLigne-eng | contactInfoCity-contacterInfoVille-eng | contactInfoProvince-contacterInfoProvince-eng | contactInfoPostalcode | contactInfoCountry-contactInfoPays-eng | contactInfoAddressLine-contactInfoAdresseLigne-fra | contactInfoCity-contacterInfoVille-fra | contactInfoProvince-contacterInfoProvince-fra | contactInfoCountry-contactInfoPays-fra | awardDescription-descriptionAttribution-eng | awardDescription-descriptionAttribution-fra
canadabuys_award_notices,legacy_award_notices_2012_to_2022_08_prior_to_canadabuys.csv,257.79,utf-8-sig,106416,80,validated,,title-titre-eng | title-titre-fra | referenceNumber-numeroReference | amendmentNumber-numeroModification | solicitationNumber-numeroSollicitation | contractNumber-numeroContrat | publicationDate-datePublication | contractAwardDate-dateAttributionContrat | amendmentDate-dateModification | contractStartDate-contratDateDebut | contractEndDate-dateFinContrat | contractAmount-montantContrat | totalContractValue-valeurTotaleContrat | contractCurrency-contratMonnaie | awardStatus-attributionStatut-eng | awardStatus-attributionStatut-fra | instrumentType-typeInstrument-eng | instrumentType-typeInstrument-fra | amendmentType-typeModification-eng | amendmentType-typeModification-fra | gsin-nibs | gsinDescription-nibsDescription-eng | gsinDescription-nibsDescription-fra | unspsc | unspscDescription-eng | unspscDescription-fra | procurementCategory-categorieApprovisionnement | noticeType-avisType-eng | noticeType-avisType-fra | procurementMethod-methodeApprovisionnement-eng | procurementMethod-methodeApprovisionnement-fra | selectionCriteria-criteresSelection-eng | selectionCriteria-criteresSelection-fra | limitedTenderingReason-raisonAppelOffresLimite-eng | limitedTenderingReason-raisonAppelOffresLimite-fra | tradeAgreements-accordsCommerciaux-eng | tradeAgreements-accordsCommerciaux-fra | regionsOfDelivery-regionsLivraison-eng | regionsOfDelivery-regionsLivraison-fra | supplierLegalName-nomLegalFournisseur-eng | supplierAddressLine-ligneAdresseFournisseur-eng | supplierAddressCity-fournisseurAdresseVille-eng | supplierAddressProvince-fournisseurAdresseProvince-eng | supplierAddressPostalCode-fournisseurAdresseCodePostal | supplierAddressCountry-fournisseurAdressePays-eng | supplierLegalName-nomLegalFournisseur-fra | supplierAddressLine-ligneAdresseFournisseur-fra | supplierAddressCity-fournisseurAdresseVille-fra | supplierAddressProvince-fournisseurAdresseProvince-fra | supplierAddressCountry-fournisseurAdressePays-fra | contractingEntityName-nomEntitContractante-eng | contractingEntityAddressLine-ligneAdresseEntiteContractante-eng | contractingEntityAddressCity-entiteContractanteAdresseVille-eng | contractingEntityAddressProvince-entiteContractanteAdresseProvince-eng | contractingEntityAddressPostalCode-entiteContractanteAdresseCodePostal | contractingEntityAddressCountry-entiteContractanteAdressePays-eng | contractingEntityName-nomEntitContractante-fra | contractingEntityAddressLine-ligneAdresseEntiteContractante-fra | contractingEntityAddressCity-entiteContractanteAdresseVille-fra | contractingEntityAddressProvince-entiteContractanteAdresseProvince-fra | contractingEntityAddressCountry-entiteContractanteAdressePays-fra | endUserEntitiesName-nomEntitesUtilisateurFinal-eng | endUserEntitiesAddress-adresseEntitesUtilisateurFinal-eng | endUserEntitiesName-nomEntitesUtilisateurFinal-fra | endUserEntitiesAddress-adresseEntitesUtilisateurFinal-fra | contactInfoName-informationsContactNom | contactInfoEmail-informationsContactCourriel | contactInfoPhone-contactInfoTelephone | contactInfoFax | contactInfoAddressLine-contactInfoAdresseLigne-eng | contactInfoCity-contacterInfoVille-eng | contactInfoProvince-contacterInfoProvince-eng | contactInfoPostalcode | contactInfoCountry-contactInfoPays-eng | contactInfoAddressLine-contactInfoAdresseLigne-fra | contactInfoCity-contacterInfoVille-fra | contactInfoProvince-contacterInfoProvince-fra | contactInfoCountry-contactInfoPays-fra | awardDescription-descriptionAttribution-eng | awardDescription-descriptionAttribution-fra
canadabuys_contract_history,all_canadabuys_contract_history_2023_06_01_onwards.csv,50.66,utf-8-sig,20221,91,validated,,title-titre-eng | title-titre-fra | referenceNumber-numeroReference | amendmentNumber-numeroModification | procurementNumber-numeroApprovisionnement | solicitationNumber-numeroSollicitation | contractNumber-numeroContrat | numberOfRecords-nombreEnregistrements | publicationDate-datePublication | contractAwardDate-dateAttributionContrat | amendmentDate-dateModification | contractStartDate-contratDateDebut | contractEndDate-dateFinContrat | contractAmount-montantContrat | totalContractValue-valeurTotaleContrat | contractCurrency-contratMonnaie | contractStatus-statutContrat-eng | contractStatus-statutContrat-fra | instrumentType-typeInstrument-eng | instrumentType-typeInstrument-fra | amendmentType-typeModification-eng | amendmentType-typeModification-fra | gsin-nibs | gsinDescription-nibsDescription-eng | gsinDescription-nibsDescription-fra | unspsc | unspscDescription-eng | unspscDescription-fra | procurementCategory-categorieApprovisionnement | noticeType-avisType-eng | noticeType-avisType-fra | procurementMethod-methodeApprovisionnement-eng | procurementMethod-methodeApprovisionnement-fra | selectionCriteria-criteresSelection-eng | selectionCriteria-criteresSelection-fra | limitedTenderingReason-raisonAppelOffresLimite-eng | limitedTenderingReason-raisonAppelOffresLimite-fra | tradeAgreements-accordsCommerciaux-eng | tradeAgreements-accordsCommerciaux-fra | regionsOfDelivery-regionsLivraison-eng | regionsOfDelivery-regionsLivraison-fra | supplierLegalName-nomLegalFournisseur-eng | supplierLegalName-nomLegalFournisseur-fra | supplierStandardizedName-nomNormaliseFournisseur-eng | supplierStandardizedName-nomNormaliseFournisseur-fra | supplierOperatingName-nomCommercialFournisseur-eng | supplierOperatingName-nomCommercialFournisseur-fra | supplierEmployeeCount-fournisseurNombreEmployes-eng | supplierEmployeeCount-fournisseurNombreEmployes-fra | supplierAddressLine-ligneAdresseFournisseur-eng | supplierAddressLine-ligneAdresseFournisseur-fra | supplierAddressCity-fournisseurAdresseVille-eng | supplierAddressCity-fournisseurAdresseVille-fra | supplierAddressProvince-fournisseurAdresseProvince-eng | supplierAddressProvince-fournisseurAdresseProvince-fra | supplierAddressPostalCode-fournisseurAdresseCodePostal | supplierAddressCountry-fournisseurAdressePays-eng | supplierAddressCountry-fournisseurAdressePays-fra | contractingEntityName-nomEntitContractante-eng | contractingEntityName-nomEntitContractante-fra | contractingEntityAddressLine-ligneAdresseEntiteContractante-eng | contractingEntityAddressLine-ligneAdresseEntiteContractante-fra | contractingEntityAddressCity-entiteContractanteAdresseVille-eng | contractingEntityAddressCity-entiteContractanteAdresseVille-fra | contractingEntityAddressProvince-entiteContractanteAdresseProvince-eng | contractingEntityAddressProvince-entiteContractanteAdresseProvince-fra | contractingEntityAddressPostalCode-entiteContractanteAdresseCodePostal | contractingEntityAddressCountry-entiteContractanteAdressePays-eng | contractingEntityAddressCountry-entiteContractanteAdressePays-fra | endUserEntitiesName-nomEntitesUtilisateurFinal-eng | endUserEntitiesName-nomEntitesUtilisateurFinal-fra | endUserEntitiesOfficeName-bureauNomEntitesUtilisateurFinal-eng | endUserEntitiesOfficeName-bureauNomEntitesUtilisateurFinal-fra | endUserEntitiesAddress-adresseEntitesUtilisateurFinal-eng | endUserEntitiesAddress-adresseEntitesUtilisateurFinal-fra | contactInfoName-informationsContactNom | contactInfoEmail-informationsContactCourriel | contactInfoPhone-contactInfoTelephone | contactInfoFax | contactInfoAddressLine-contactInfoAdresseLigne-eng | contactInfoAddressLine-contactInfoAdresseLigne-fra | contactInfoCity-contacterInfoVille-eng | contactInfoCity-contacterInfoVille-fra | contactInfoProvince-contacterInfoProvince-eng | contactInfoProvince-contacterInfoProvince-fra | contactInfoPostalcode | contactInfoCountry-contactInfoPays-eng | contactInfoCountry-contactInfoPays-fra | percentageOfGoodsByCountry-pourcentageDeBiensParPays | tenderDescription-descriptionAppelOffres-eng | tenderDescription-descriptionAppelOffres-fra
canadabuys_contract_history,legacy_contract_history_2009_01_to_2023_05_prior_to_canadabuys.csv,791.9,utf-8-sig,484981,91,validated,,title-titre-eng | title-titre-fra | referenceNumber-numeroReference | amendmentNumber-numeroModification | procurementNumber-numeroApprovisionnement | solicitationNumber-numeroSollicitation | contractNumber-numeroContrat | numberOfRecords-nombreEnregistrements | publicationDate-datePublication | contractAwardDate-dateAttributionContrat | amendmentDate-dateModification | contractStartDate-contratDateDebut | contractEndDate-dateFinContrat | contractAmount-montantContrat | totalContractValue-valeurTotaleContrat | contractCurrency-contratMonnaie | contractStatus-statutContrat-eng | contractStatus-statutContrat-fra | instrumentType-typeInstrument-eng | instrumentType-typeInstrument-fra | amendmentType-typeModification-eng | amendmentType-typeModification-fra | gsin-nibs | gsinDescription-nibsDescription-eng | gsinDescription-nibsDescription-fra | unspsc | unspscDescription-eng | unspscDescription-fra | procurementCategory-categorieApprovisionnement | noticeType-avisType-eng | noticeType-avisType-fra | procurementMethod-methodeApprovisionnement-eng | procurementMethod-methodeApprovisionnement-fra | selectionCriteria-criteresSelection-eng | selectionCriteria-criteresSelection-fra | limitedTenderingReason-raisonAppelOffresLimite-eng | limitedTenderingReason-raisonAppelOffresLimite-fra | tradeAgreements-accordsCommerciaux-eng | tradeAgreements-accordsCommerciaux-fra | regionsOfDelivery-regionsLivraison-eng | regionsOfDelivery-regionsLivraison-fra | supplierLegalName-nomLegalFournisseur-eng | supplierLegalName-nomLegalFournisseur-fra | supplierStandardizedName-nomNormaliseFournisseur-eng | supplierStandardizedName-nomNormaliseFournisseur-fra | supplierOperatingName-nomCommercialFournisseur-eng | supplierOperatingName-nomCommercialFournisseur-fra | supplierEmployeeCount-fournisseurNombreEmployes-eng | supplierEmployeeCount-fournisseurNombreEmployes-fra | supplierAddressLine-ligneAdresseFournisseur-eng | supplierAddressLine-ligneAdresseFournisseur-fra | supplierAddressCity-fournisseurAdresseVille-eng | supplierAddressCity-fournisseurAdresseVille-fra | supplierAddressProvince-fournisseurAdresseProvince-eng | supplierAddressProvince-fournisseurAdresseProvince-fra | supplierAddressPostalCode-fournisseurAdresseCodePostal | supplierAddressCountry-fournisseurAdressePays-eng | supplierAddressCountry-fournisseurAdressePays-fra | contractingEntityName-nomEntitContractante-eng | contractingEntityName-nomEntitContractante-fra | contractingEntityAddressLine-ligneAdresseEntiteContractante-eng | contractingEntityAddressLine-ligneAdresseEntiteContractante-fra | contractingEntityAddressCity-entiteContractanteAdresseVille-eng | contractingEntityAddressCity-entiteContractanteAdresseVille-fra | contractingEntityAddressProvince-entiteContractanteAdresseProvince-eng | contractingEntityAddressProvince-entiteContractanteAdresseProvince-fra | contractingEntityAddressPostalCode-entiteContractanteAdresseCodePostal | contractingEntityAddressCountry-entiteContractanteAdressePays-eng | contractingEntityAddressCountry-entiteContractanteAdressePays-fra | endUserEntitiesName-nomEntitesUtilisateurFinal-eng | endUserEntitiesName-nomEntitesUtilisateurFinal-fra | endUserEntitiesOfficeName-bureauNomEntitesUtilisateurFinal-eng | endUserEntitiesOfficeName-bureauNomEntitesUtilisateurFinal-fra | endUserEntitiesAddress-adresseEntitesUtilisateurFinal-eng | endUserEntitiesAddress-adresseEntitesUtilisateurFinal-fra | contactInfoName-informationsContactNom | contactInfoEmail-informationsContactCourriel | contactInfoPhone-contactInfoTelephone | contactInfoFax | contactInfoAddressLine-contactInfoAdresseLigne-eng | contactInfoAddressLine-contactInfoAdresseLigne-fra | contactInfoCity-contacterInfoVille-eng | contactInfoCity-contacterInfoVille-fra | contactInfoProvince-contacterInfoProvince-eng | contactInfoProvince-contacterInfoProvince-fra | contactInfoPostalcode | contactInfoCountry-contactInfoPays-eng | contactInfoCountry-contactInfoPays-fra | percentageOfGoodsByCountry-pourcentageDeBiensParPays | tenderDescription-descriptionAppelOffres-eng | tenderDescription-descriptionAppelOffres-fra
canadabuys_tender_notices,all_canadabuys_tender_notices_2022_08_08_onwards.csv,162.58,utf-8-sig,28048,67,validated,,title-titre-eng | title-titre-fra | referenceNumber-numeroReference | amendmentNumber-numeroModification | solicitationNumber-numeroSollicitation | publicationDate-datePublication | tenderClosingDate-appelOffresDateCloture | amendmentDate-dateModification | expectedContractStartDate-dateDebutContratPrevue | expectedContractEndDate-dateFinContratPrevue | tenderStatus-appelOffresStatut-eng | tenderStatus-appelOffresStatut-fra | gsin-nibs | gsinDescription-nibsDescription-eng | gsinDescription-nibsDescription-fra | unspsc | unspscDescription-eng | unspscDescription-fra | procurementCategory-categorieApprovisionnement | noticeType-avisType-eng | noticeType-avisType-fra | procurementMethod-methodeApprovisionnement-eng | procurementMethod-methodeApprovisionnement-fra | selectionCriteria-criteresSelection-eng | selectionCriteria-criteresSelection-fra | limitedTenderingReason-raisonAppelOffresLimite-eng | limitedTenderingReason-raisonAppelOffresLimite-fra | tradeAgreements-accordsCommerciaux-eng | tradeAgreements-accordsCommerciaux-fra | regionsOfOpportunity-regionAppelOffres-eng | regionsOfOpportunity-regionAppelOffres-fra | regionsOfDelivery-regionsLivraison-eng | regionsOfDelivery-regionsLivraison-fra | contractingEntityName-nomEntitContractante-eng | contractingEntityAddressLine-ligneAdresseEntiteContractante-eng | contractingEntityAddressCity-entiteContractanteAdresseVille-eng | contractingEntityAddressProvince-entiteContractanteAdresseProvince-eng | contractingEntityAddressPostalCode-entiteContractanteAdresseCodePostal | contractingEntityAddressCountry-entiteContractanteAdressePays-eng | contractingEntityName-nomEntitContractante-fra | contractingEntityAddressLine-ligneAdresseEntiteContractante-fra | contractingEntityAddressCity-entiteContractanteAdresseVille-fra | contractingEntityAddressProvince-entiteContractanteAdresseProvince-fra | contractingEntityAddressCountry-entiteContractanteAdressePays-fra | endUserEntitiesName-nomEntitesUtilisateurFinal-eng | endUserEntitiesAddress-adresseEntitesUtilisateurFinal-eng | endUserEntitiesName-nomEntitesUtilisateurFinal-fra | endUserEntitiesAddress-adresseEntitesUtilisateurFinal-fra | contactInfoName-informationsContactNom | contactInfoEmail-informationsContactCourriel | contactInfoPhone-contactInfoTelephone | contactInfoFax | contactInfoAddressLine-contactInfoAdresseLigne-eng | contactInfoCity-contacterInfoVille-eng | contactInfoProvince-contacterInfoProvince-eng | contactInfoPostalcode | contactInfoCountry-contactInfoPays-eng | contactInfoAddressLine-contactInfoAdresseLigne-fra | contactInfoCity-contacterInfoVille-fra | contactInfoProvince-contacterInfoProvince-fra | contactInfoCountry-contactInfoPays-fra | noticeURL-URLavis-eng | noticeURL-URLavis-fra | attachment-piecesJointes-eng | attachment-piecesJointes-fra | tenderDescription-descriptionAppelOffres-eng | tenderDescription-descriptionAppelOffres-fra
canadabuys_tender_notices,archived_2009_2022_legacy_tender_notices.csv,532.53,utf-8-sig,71309,67,validated,,title-titre-eng | title-titre-fra | referenceNumber-numeroReference | amendmentNumber-numeroModification | solicitationNumber-numeroSollicitation | publicationDate-datePublication | tenderClosingDate-appelOffresDateCloture | amendmentDate-dateModification | expectedContractStartDate-dateDebutContratPrevue | expectedContractEndDate-dateFinContratPrevue | tenderStatus-appelOffresStatut-eng | tenderStatus-appelOffresStatut-fra | gsin-nibs | gsinDescription-nibsDescription-eng | gsinDescription-nibsDescription-fra | unspsc | unspscDescription-eng | unspscDescription-fra | procurementCategory-categorieApprovisionnement | noticeType-avisType-eng | noticeType-avisType-fra | procurementMethod-methodeApprovisionnement-eng | procurementMethod-methodeApprovisionnement-fra | selectionCriteria-criteresSelection-eng | selectionCriteria-criteresSelection-fra | limitedTenderingReason-raisonAppelOffresLimite-eng | limitedTenderingReason-raisonAppelOffresLimite-fra | tradeAgreements-accordsCommerciaux-eng | tradeAgreements-accordsCommerciaux-fra | regionsOfOpportunity-regionAppelOffres-eng | regionsOfOpportunity-regionAppelOffres-fra | regionsOfDelivery-regionsLivraison-eng | regionsOfDelivery-regionsLivraison-fra | contractingEntityName-nomEntitContractante-eng | contractingEntityAddressLine-ligneAdresseEntiteContractante-eng | contractingEntityAddressCity-entiteContractanteAdresseVille-eng | contractingEntityAddressProvince-entiteContractanteAdresseProvince-eng | contractingEntityAddressPostalCode-entiteContractanteAdresseCodePostal | contractingEntityAddressCountry-entiteContractanteAdressePays-eng | contractingEntityName-nomEntitContractante-fra | contractingEntityAddressLine-ligneAdresseEntiteContractante-fra | contractingEntityAddressCity-entiteContractanteAdresseVille-fra | contractingEntityAddressProvince-entiteContractanteAdresseProvince-fra | contractingEntityAddressCountry-entiteContractanteAdressePays-fra | endUserEntitiesName-nomEntitesUtilisateurFinal-eng | endUserEntitiesAddress-adresseEntitesUtilisateurFinal-eng | endUserEntitiesName-nomEntitesUtilisateurFinal-fra | endUserEntitiesAddress-adresseEntitesUtilisateurFinal-fra | contactInfoName-informationsContactNom | contactInfoEmail-informationsContactCourriel | contactInfoPhone-contactInfoTelephone | contactInfoFax | contactInfoAddressLine-contactInfoAdresseLigne-eng | contactInfoCity-contacterInfoVille-eng | contactInfoProvince-contacterInfoProvince-eng | contactInfoPostalcode | contactInfoCountry-contactInfoPays-eng | contactInfoAddressLine-contactInfoAdresseLigne-fra | contactInfoCity-contacterInfoVille-fra | contactInfoProvince-contacterInfoProvince-fra | contactInfoCountry-contactInfoPays-fra | noticeURL-URLavis-eng | noticeURL-URLavis-fra | attachment-piecesJointes-eng | attachment-piecesJointes-fra | tenderDescription-descriptionAppelOffres-eng | tenderDescription-descriptionAppelOffres-fra

docs/history/build_logs/sprint_0004_raw_data_download.md

## Files Downloaded

- canadabuys_tender_notices | All CanadaBuys tender notices, 2022-08-08 onwards | 162.58 MB
  - `C:\ProcurementIntelligence\data\raw\canadabuys_tender_notices\all_canadabuys_tender_notices_2022_08_08_onwards.csv`
- canadabuys_tender_notices | Archived, 2009-2022 legacy tender notices | 532.53 MB
  - `C:\ProcurementIntelligence\data\raw\canadabuys_tender_notices\archived_2009_2022_legacy_tender_notices.csv`
- canadabuys_award_notices | All CanadaBuys award notices, 2022-08-08 onwards | 88.96 MB
  - `C:\ProcurementIntelligence\data\raw\canadabuys_award_notices\all_canadabuys_award_notices_2022_08_08_onwards.csv`
- canadabuys_award_notices | Legacy award notices, 2012 to 2022-08 (prior to CanadaBuys) | 257.79 MB
  - `C:\ProcurementIntelligence\data\raw\canadabuys_award_notices\legacy_award_notices_2012_to_2022_08_prior_to_canadabuys.csv`
- canadabuys_contract_history | All CanadaBuys contract history, 2023-06-01 onwards | 50.66 MB
  - `C:\ProcurementIntelligence\data\raw\canadabuys_contract_history\all_canadabuys_contract_history_2023_06_01_onwards.csv`
- canadabuys_contract_history | Legacy contract history, 2009-01 to 2023-05 (prior to CanadaBuys) | 791.9 MB
  - `C:\ProcurementIntelligence\data\raw\canadabuys_contract_history\legacy_contract_history_2009_01_to_2023_05_prior_to_canadabuys.csv`